{
  "version": "1.0",
  "projectName": "Gully",
  "projectContext": {
    "techSpecRef": "docs/planning/TECH_SPEC.json",
    "architectureSummary": "Modular monolith with Node.js 20+/Express/TypeScript, PostgreSQL 15 database, Redis 7 cache, JWT authentication, REST APIs with clear service boundaries designed for future microservices migration at scale (100K+ users).",
    "maturityModel": {
      "levels": [
        {
          "level": "sequential",
          "description": "Foundation building phase - User Service and Team Service are critical dependencies with high interdependency. Sequential development only to ensure stability.",
          "parallelizationCapacity": "1 stream (sequential only)"
        },
        {
          "level": "controlled-parallel",
          "description": "Stable base established - User and Team services have 90%+ coverage with stable interfaces. Match Service and supporting features can be developed in 2-3 parallel streams.",
          "parallelizationCapacity": "2-3 streams"
        },
        {
          "level": "full-parallel",
          "description": "Mature system - Core services stable with comprehensive test coverage. Stats, League, Tournament services can be developed independently by multiple agents in parallel.",
          "parallelizationCapacity": "unlimited streams"
        }
      ],
      "currentLevel": "sequential"
    },
    "technologyStack": {
      "backend": "Node.js 20+ with Express.js and TypeScript",
      "database": "PostgreSQL 15 with Redis 7 cache",
      "testing": "Jest with TDD workflow, 90%+ coverage target"
    }
  },
  "phases": [
    {
      "phaseId": "P1",
      "phaseName": "User Service Foundation",
      "features": ["User Authentication"],
      "maturityLevel": "sequential",
      "dependencies": [],
      "criticalPath": true,
      "maturityGate": {
        "nfrChecks": {
          "testCoverageTarget": "90%+ for all User Service production code",
          "performanceTarget": "<100ms for auth endpoints (register, login, token refresh)",
          "securityChecks": [
            "JWT authentication working with 7-day expiration",
            "Password hashing with bcrypt (12 rounds)",
            "No authentication vulnerabilities (tested for SQL injection, XSS, token leakage)",
            "Refresh token support implemented"
          ]
        },
        "phaseSpecificChecks": [
          "User registration endpoint complete and tested",
          "User login endpoint complete and tested",
          "JWT token generation and validation working",
          "Password reset flow implemented",
          "All auth middleware integration tests passing",
          "No TypeScript errors in User Service",
          "Build succeeds for User Service"
        ],
        "integrationTestsPassing": true,
        "buildSuccessful": true
      },
      "taskSkeletons": [
        {
          "taskId": "P1-AUTH-T1",
          "title": "POST /api/auth/register - User Registration",
          "priority": "critical",
          "feature": "User Authentication",
          "scope": "Implement user registration endpoint with email/password validation, bcrypt password hashing, and automatic JWT token generation upon successful registration.",
          "requirements": [
            "Accept email, password, name, location in request body",
            "Validate email format and uniqueness",
            "Hash password with bcrypt (12 rounds)",
            "Generate UUID for user_id",
            "Store user in PostgreSQL users table",
            "Return JWT token and user object (excluding password_hash)",
            "Handle duplicate email registration gracefully (409 Conflict)"
          ],
          "complexity": "moderate",
          "dependencies": [],
          "context": {
            "architecturalGuidance": "modular-monolith with clear service boundaries in services/user-service/",
            "technologyStack": "Node.js + Express + TypeScript + PostgreSQL + bcrypt + jsonwebtoken",
            "testingApproach": "TDD with 90%+ coverage (unit tests for controller/repository, integration tests for route/auth flow, e2e for complete registration flow)",
            "performanceTarget": "<100ms response time",
            "securityGuidance": "JWT with bcrypt password hashing, Zod input validation, prevent SQL injection with parameterized queries"
          }
        },
        {
          "taskId": "P1-AUTH-T2",
          "title": "POST /api/auth/login - User Login",
          "priority": "critical",
          "feature": "User Authentication",
          "scope": "Implement user login endpoint with email/password verification, JWT token generation, and proper error handling for invalid credentials.",
          "requirements": [
            "Accept email and password in request body",
            "Validate email format",
            "Retrieve user from database by email",
            "Verify password using bcrypt.compare",
            "Generate JWT token with 7-day expiration",
            "Return JWT token and user object (excluding password_hash)",
            "Return 401 for invalid credentials with generic error message",
            "Skip soft-deleted users (is_active=false)"
          ],
          "complexity": "moderate",
          "dependencies": ["P1-AUTH-T1"],
          "context": {
            "architecturalGuidance": "modular-monolith with clear service boundaries in services/user-service/",
            "technologyStack": "Node.js + Express + TypeScript + PostgreSQL + bcrypt + jsonwebtoken",
            "testingApproach": "TDD with 90%+ coverage (unit, integration, e2e, security tests for timing attacks)",
            "performanceTarget": "<100ms response time",
            "securityGuidance": "JWT with bcrypt password verification, prevent timing attacks with constant-time comparison, generic error messages"
          }
        },
        {
          "taskId": "P1-AUTH-T3",
          "title": "POST /api/auth/refresh - Token Refresh",
          "priority": "high",
          "feature": "User Authentication",
          "scope": "Implement token refresh endpoint to allow users to obtain new JWT tokens before expiration without re-authenticating.",
          "requirements": [
            "Accept valid JWT token in Authorization header",
            "Verify token signature and expiration",
            "Generate new JWT token with fresh 7-day expiration",
            "Return new token and updated user object",
            "Return 401 for expired or invalid tokens"
          ],
          "complexity": "simple",
          "dependencies": ["P1-AUTH-T2"],
          "context": {
            "architecturalGuidance": "modular-monolith with auth middleware reuse",
            "technologyStack": "Node.js + Express + TypeScript + jsonwebtoken",
            "testingApproach": "TDD with 90%+ coverage (unit, integration, e2e)",
            "performanceTarget": "<100ms response time",
            "securityGuidance": "JWT verification with proper error handling for expired/invalid tokens"
          }
        },
        {
          "taskId": "P1-AUTH-T4",
          "title": "POST /api/auth/password-reset - Password Reset Flow",
          "priority": "high",
          "feature": "User Authentication",
          "scope": "Implement password reset flow with email-based token verification. Includes reset token generation, email sending, and password update with token validation.",
          "requirements": [
            "Accept email in request body for reset initiation",
            "Generate secure reset token (UUID or crypto-random)",
            "Store reset token with expiration (1 hour) in database",
            "Send reset email with token (via SendGrid/Mailgun)",
            "Verify reset token on password update request",
            "Update password with bcrypt hashing",
            "Invalidate reset token after successful update",
            "Return 400 for expired or invalid tokens"
          ],
          "complexity": "complex",
          "dependencies": ["P1-AUTH-T1"],
          "context": {
            "architecturalGuidance": "modular-monolith with email service integration",
            "technologyStack": "Node.js + Express + TypeScript + PostgreSQL + SendGrid/Mailgun",
            "testingApproach": "TDD with 90%+ coverage (unit, integration, e2e, edge cases for token expiration)",
            "performanceTarget": "<200ms for token generation, <500ms for email sending",
            "securityGuidance": "Secure token generation, token expiration, prevent token reuse, generic error messages"
          }
        }
      ]
    },
    {
      "phaseId": "P2",
      "phaseName": "User Profiles & Sports Preferences",
      "features": ["User Profiles"],
      "maturityLevel": "sequential",
      "dependencies": ["P1"],
      "criticalPath": true,
      "maturityGate": {
        "nfrChecks": {
          "testCoverageTarget": "90%+ for all User Service production code (including profiles)",
          "performanceTarget": "<100ms for profile CRUD operations, <500ms for user search with filters",
          "securityChecks": [
            "Field-level access control working (own profile shows all fields, other profiles hide email/phone)",
            "Password hash never exposed in API responses",
            "Input validation with Zod on all profile endpoints"
          ]
        },
        "phaseSpecificChecks": [
          "User profile retrieval (GET /api/users/:id) complete and tested",
          "User profile update (PATCH /api/users/:id) complete and tested",
          "User soft delete (DELETE /api/users/:id) complete and tested",
          "Sports preferences management (POST/DELETE /api/users/:id/sports) complete and tested",
          "User search with filters (GET /api/users/search) complete and tested",
          "Integration tests with User Service auth passing",
          "user_sports JOIN query optimized (<100ms)",